{
  "owner_person_id": "person-atlas01",
  "root": {
    "mount_id": null,
    "path": "/Volumes/Media/Shows",
    "kinds": [
      "episode"
    ]
  },
  "feed_id": null,
  "url": null,
  "extractor": null,
  "auto": {
    "save": "none",
    "keep_latest": null,
    "remove_watched": false,
    "max_per_check": 2,
    "max_duration_s": null,
    "min_duration_s": null,
    "skip_shorts": true,
    "cutoff_date": null,
    "quality_max_height": null
  },
  "speed": null,
  "skip_intro_s": 0,
  "skip_outro_s": 0,
  "poll_minutes": 30,
  "paused": false,
  "last_checked_at": "2026-10-17T11:30:00Z",
  "last_status": "ok",
  "failures": 0,
  "backoff_until": null,
  "visible_to": "household",
  "archive": [],
  "deleted_at": null,
  "trash_until": null,
  "created_at": "2026-10-17T12:00:00Z",
  "hlc": "1791547200000:0:hub001",
  "provenance": "hub",
  "id": "msrc-root02",
  "kind": "root",
  "scope": "household",
  "label": "Shows"
}
